<xs:schema attributeFormDefault="unqualified" elementFormDefault="qualified"
           xmlns:xs="http://www.w3.org/2001/XMLSchema">
    <xs:element name="office">
        <xs:complexType>
            <xs:sequence>
                <xs:element name="category" maxOccurs="unbounded" minOccurs="0">
                    <xs:complexType>
                        <xs:sequence>
                            <xs:element name="product" maxOccurs="unbounded" minOccurs="0">
                                <xs:complexType>
                                    <xs:sequence>
                                        <xs:element type="xs:string" name="type"/>
                                        <xs:element type="xs:string" name="company"/>
                                        <xs:element type="xs:string" name="country"/>
                                        <xs:element type="xs:string" name="purpose"/>
                                        <xs:element name="cost">
                                            <xs:complexType>
                                                <xs:simpleContent>
                                                    <xs:extension base="xs:double">
                                                        <xs:attribute type="xs:string" name="currency" use="required"/>
                                                    </xs:extension>
                                                </xs:simpleContent>
                                            </xs:complexType>
                                        </xs:element>
                                    </xs:sequence>
                                    <xs:attribute type="xs:byte" name="id" use="required"/>
                                </xs:complexType>
                            </xs:element>
                        </xs:sequence>
                        <xs:attribute type="xs:string" name="name" use="required"/>
                    </xs:complexType>
                </xs:element>
            </xs:sequence>
            <xs:attribute type="xs:string" name="name"/>
        </xs:complexType>
    </xs:element>
</xs:schema>